{
  "format": "update-p5-ai-edit",
  "version": 1,
  "metadata": {
    "title": "ChatGPT portable import example",
    "generated_by": "ChatGPT"
  },
  "variables": {
    "MAIN_VIDEO": ""
  },
  "safety": {
    "checkpoint": true,
    "checkpoint_label": "before-chatgpt-edit"
  },
  "steps": [
    {
      "id": "video-track",
      "tool": "kdenlive_add_track",
      "arguments": {"audio": false, "name": "Main Video"}
    },
    {
      "id": "import-main",
      "tool": "kdenlive_import_media",
      "arguments": {"path": {"$var": "MAIN_VIDEO"}}
    },
    {
      "id": "insert-main",
      "tool": "kdenlive_insert_bin_clip",
      "arguments": {
        "bin_id": {"$ref": "import-main.result.bin_id"},
        "track_id": {"$ref": "video-track.result.track_id"},
        "position_seconds": 0,
        "use_targets": false
      }
    },
    {
      "id": "zoom-key-point",
      "tool": "kdenlive_set_transform",
      "arguments": {
        "clip_id": {
          "$clip_at": {
            "position_seconds": 12.0,
            "track": {"audio": false, "index": 0}
          }
        },
        "scale_percent": 110
      }
    }
  ]
}
